{
  "protocol_version": "1.0",
  "run_id": "run_status_examples_expanded_01",
  "orchestrator": "orchestrator-pipeline",
  "status": "waiting_for_user",
  "created_at": "2026-03-17T15:00:00Z",
  "updated_at": "2026-03-17T15:29:00Z",
  "output_dir": ".pipeline-output/status-layout.expanded.valid",
  "checkpoint_path": ".pipeline-output/status-layout.expanded.valid/checkpoint.json",
  "user_prompt": "Execute reviewable status examples that cover heavy-resource cleanup, crash recovery, and resume triage.",
  "current_stage": 4,
  "completed_stages": [
    {
      "stage": 0,
      "name": "specify",
      "status": "completed",
      "artifact_key": "problem_spec",
      "timestamp": "2026-03-17T15:03:00Z"
    },
    {
      "stage": 1,
      "name": "plan",
      "status": "completed",
      "artifact_key": "plan_outline",
      "timestamp": "2026-03-17T15:07:00Z"
    },
    {
      "stage": 2,
      "name": "route",
      "status": "completed",
      "artifact_key": "dispatch_plan",
      "timestamp": "2026-03-17T15:10:00Z"
    }
  ],
  "next_stage": 5,
  "task_list_path": ".pipeline-output/status-layout.expanded.valid/task-list.json",
  "dispatch_plan_path": ".pipeline-output/status-layout.expanded.valid/dispatch-plan.json",
  "layout": "expanded",
  "task_counts": {
    "pending": 0,
    "ready": 0,
    "in_progress": 0,
    "waiting_for_user": 0,
    "done": 2,
    "blocked": 1,
    "failed": 0,
    "skipped": 0,
    "stale": 1
  },
  "active_task_ids": [
    "task-local-server-smoke",
    "task-browser-resume"
  ],
  "active_agent_ids": [
    "agent-server-01",
    "agent-browser-02"
  ],
  "waiting_on": "cleanup",
  "resume_from_checkpoint": true,
  "last_heartbeat_at": "2026-03-17T15:27:30Z",
  "last_error": "Resume triage found one stale browser attempt and one cleanup_failed server attempt that need explicit operator review.",
  "notes": [
    "Expanded layout is used because per-task resume triage and heavy-resource cleanup details would be too noisy in one file.",
    "The stale browser attempt must be redispatched as a new agent attempt or left blocked until a human confirms the old process tree is gone.",
    "The blocked server task stays non-terminal because cleanup evidence is incomplete, so the run pauses for cleanup-focused user review."
  ],
  "task_refs": [
    {
      "task_id": "task-doc-summary",
      "path": "status/tasks/task-doc-summary.json"
    },
    {
      "task_id": "task-process-build",
      "path": "status/tasks/task-process-build.json"
    },
    {
      "task_id": "task-local-server-smoke",
      "path": "status/tasks/task-local-server-smoke.json"
    },
    {
      "task_id": "task-browser-resume",
      "path": "status/tasks/task-browser-resume.json"
    }
  ],
  "agent_refs": [
    {
      "agent_id": "agent-doc-01",
      "path": "status/agents/agent-doc-01.json"
    },
    {
      "agent_id": "agent-process-01",
      "path": "status/agents/agent-process-01.json"
    },
    {
      "agent_id": "agent-server-01",
      "path": "status/agents/agent-server-01.json"
    },
    {
      "agent_id": "agent-browser-02",
      "path": "status/agents/agent-browser-02.json"
    }
  ]
}
